{"schemaVersion":1,"id":"demo.core","version":"1.0.0","sequence":1,"kind":"content","createdAt":"2026-01-01T00:00:00Z","pathPrefixes":[],"fileTable":{"format":"jsonl/v1","shardCount":1,"digest":"sha256:0000000000000000000000000000000000000000000000000000000000000000","shards":[{"index":0,"digest":"sha256:0000000000000000000000000000000000000000000000000000000000000000","count":0,"size":0}]},"fileCount":0,"installSize":0,"downloadSize":0}
